{
  "schema_version": "1.0",
  "dispatch_id": "E002-B01-MASTER-A1",
  "episode_id": "E002",
  "target_id": "B01",
  "operation": "GENERATE_MASTER_BOARD",
  "prompt": "Create one TEXT-FREE 2x2 storyboard master board for a Korean Instagram comic.\nAll four cells are portrait 4:5 with clean straight gutters. Draw the occupied cells as one coherent episode in the same visual hand.\nThe attached images are binding visual references with separate roles:\n- Harin identity and person drawing language: use only identity proportions, eye grammar, line and flat-color behavior; never infer current pose, camera, action, story or location\n- scene and background drawing language: use only shared character/background abstraction, line and restrained shading; never infer room layout, current pose, story, clothing or cast requirement\nPalette: reference-led muted everyday local colors, denim blue reserved for the story-bearing jeans, no global beige wash.\nLine/shape behavior: simple hand-drawn black outline; flat local color; restrained or near-zero modeled shading; small consistent human irregularity.\nCells:\n- TOP_LEFT S01: shot=현관/거실 경계의 eye-level medium two-shot; 여자친구는 갈아입은 편한 옷 차림, 남자친구는 옆에 서 있고 청바지가 두 사람 사이의 시각적 초점; action=여자친구가 술이 묻은 청바지를 빨래 바구니 쪽에 내려놓으며 가볍게 부탁하고, 남자친구는 별일 아니라는 듯 고개를 끄덕인다.; expression=여자친구는 대수롭지 않은 표정, 남자친구는 편안한 수긍; visual_owner=RELATIONSHIP; beat=술이 묻은 청바지를 남자친구 집에 두고 가며 세탁기에 같이 돌려 달라고 가볍게 부탁한다.; leave_text_space=상단 좌측과 두 인물 머리 사이의 여백; 청바지와 손 동작은 가리지 않음\n- TOP_RIGHT S02: shot=남자친구 뒤쪽 3/4 over-shoulder medium-close; 한 손에 청바지 허리 부분, 다른 손에 휴대폰, 시선은 휴대폰으로 향함; action=남자친구가 청바지 상태를 확인한 뒤 휴대폰으로 세탁법을 찾아본다. 화면 내용은 관객에게 읽히지 않도록 한다.; expression=사소한 일을 지나치게 진지하게 받아들인 집중/걱정; visual_owner=ACTION; beat=혼자 남은 남자친구가 청바지와 휴대폰을 번갈아 보며 세탁법을 검색한다.; leave_text_space=상단 좌측 벽면 여백; 휴대폰과 청바지를 가리지 않음; screen_geometry={\"viewer_sees\":\"phone back edge and oblique non-readable glow only\",\"character_sees\":\"phone front\",\"meaning_bearing_ui_in_art\":false}; anatomy_contract={\"risk_reason\":\"청바지와 휴대폰을 동시에 다루는 컷이라 모델이 턱 짚기 같은 제3의 손동작을 덧붙일 위험이 큼\",\"limb_roles\":[\"BF prop hand: 청바지만 잡는다\",\"BF device hand: 휴대폰만 잡는다\"],\"required_contacts\":[\"BF 한 손 -> 청바지\",\"BF 다른 한 손 -> 휴대폰\"],\"forbidden_outcomes\":[\"BF의 추가 팔 또는 손\",\"턱이나 머리로 향하는 추가 self-touch 손동작\",\"몸통이나 소매에 연결되지 않는 손\",\"한 손이 서로 떨어진 두 위치를 동시에 점유\"],\"simplification_fallback\":\"걱정과 집중은 눈썹, 시선, 고개 각도로 표현하고 양손은 각각 청바지와 휴대폰 역할만 유지한다.\"}\n- BOTTOM_LEFT S03: shot=욕실/세탁공간의 slightly high-angle medium-full; 몸통과 양손, 대야/세면대 속 청바지 접촉이 명확히 보이게; action=남자친구가 맨손으로 청바지를 물에 담가 천천히 주무르며 손빨래한다. 출처에 없는 첨가물이나 특수 세탁법은 묘사하지 않는다.; expression=진지하고 조심스러운 집중, 과장된 영웅 표정 금지; visual_owner=ACTION; beat=남자친구가 세면대/대야에서 청바지를 직접 조심스럽게 손빨래한다.; leave_text_space=상단 우측 벽면 여백; 손-청바지-물 접촉 영역은 비워 둠\n- BOTTOM_RIGHT S04: shot=현관/거실의 eye-level medium two-shot이되 S01보다 가까운 거리; 막 건네받은 접힌 청바지와 여자친구 표정이 중심; action=남자친구가 청바지를 건넨 직후, 여자친구가 완전히 마른 접힌 청바지를 두 손으로 들고 놀라 웃는다. 남자친구는 한 손을 뒤통수에 가볍게 대고 다른 손은 무릎이나 몸 옆에 둔다.; expression=남자친구는 담담하고 약간 머쓱함, 여자친구는 순간 놀랐다가 참지 못하고 부드럽게 웃음; visual_owner=RELATIONSHIP; beat=다음 방문, 남자친구가 말끔히 접은 청바지를 건네고 여자친구가 손빨래했다는 사실을 알아챈다.; leave_text_space=상단 중앙과 좌측 여백; 두 얼굴과 청바지 전달 동작을 가리지 않음; anatomy_contract={\"risk_reason\":\"소품 전달과 머쓱한 self-touch를 같은 순간에 겹치면 남자친구의 손과 팔이 중복 생성되기 쉬움\",\"limb_roles\":[\"GF both hands: 이미 건네받은 접힌 청바지를 든다\",\"BF expressive hand: 뒤통수에 가볍게 닿는다\",\"BF resting hand: 무릎 또는 몸 옆에 둔다\"],\"required_contacts\":[\"GF 두 손 -> 접힌 청바지\",\"BF 한 손 -> 뒤통수\",\"BF 다른 손 -> 무릎 또는 몸 옆\"],\"forbidden_outcomes\":[\"BF가 청바지를 추가로 잡는 접촉\",\"BF의 추가 팔 또는 손\",\"몸통이나 소매에 연결되지 않는 손\",\"여러 손이 작은 청바지 가장자리에 과밀하게 몰리는 구도\"],\"simplification_fallback\":\"전달 직후의 순간으로 고정한다. 여자친구가 청바지를 이미 소유하고 남자친구는 머쓱한 제스처만 남긴다.\"}\nPreserve recurring identity, clothing, palette, location facts, object states, and drawing language across cells, while making each framing and body action serve its own beat.\nThe girlfriend and boyfriend are distinct anonymous adult Korean episode-local characters newly authored inside the bound PRIMARY_STYLE drawing language; do not copy a reference character identity merely because the style reference contains recurring cast.\nKeep the same episode-local girlfriend identity across S01/S04 and the same episode-local boyfriend identity across S01-S04. Keep the boyfriend outfit/hair stable through S01-S03; S04 occurs on a later visit but do not use clothing change as a storytelling device unless needed for temporal readability.\nThe story-bearing jeans are the same denim item across cells: stained/dry before washing, wet during hand-washing, completely dry and neatly folded on the later visit.\nS02 phone geometry is mandatory: the boyfriend sees the phone front; the viewer sees only the back edge/oblique non-readable glow. Never put a readable screen on the outward-facing phone surface.\nDo not add titles, dialogue, captions, speech bubbles, letters, numerals, logos, watermarks, panel labels, readable product packaging, or readable UI text.\nReject: generic glossy anime or webtoon beautification; detailed irises and shiny hair; cinematic depth of field or lighting; global beige wash; uniform lead-like extras; generated letters numerals logos watermarks or readable UI; use of calibration quarantine or other rejected generated artifacts as reference.\nReturn exactly one master-board image and nothing else inside the image.",
  "bound_media": [
    {
      "path_or_handle": "calibration/references/REF_V2_D_MAIN_CAST_GAEUN_HARIN_TAEMIN.jpeg",
      "sha256": "dbddf458a97c89781075e6be03ab2c393eff75b95e8856f044bd81f29310ec07",
      "role": "Harin identity and person drawing language"
    },
    {
      "path_or_handle": "calibration/references/REF_V2_E_3PERSON_INDOOR_SCENE.jpeg",
      "sha256": "b49683276f94ba5621e3602d7e3d714b0f2e637b2c41fc1fd132bdf6f336b049",
      "role": "scene and background drawing language"
    }
  ],
  "attempt": 1,
  "status": "READY"
}
